{
  "id": "plan_018f3c8e9b2a7c4d8f1e2a3b4c5d6e7f",
  "objective_id": "obj_018f3c8e9b2a7c4d8f1e2a3b4c5d6e7f",
  "supersedes_plan_id": "plan_018f3c8e9b2a7c4d8f1e2a3b4c5d6e80",
  "status": "candidate",
  "steps": [
    {
      "index": 0,
      "task_id": "task_018f3c8e9b2a7c4d8f1e2a3b4c5d6e7f",
      "summary": "Place implementation work on the plan",
      "start": "2026-06-17T13:00:00Z",
      "end": "2026-06-17T14:00:00Z",
      "static_anchor": true
    },
    {
      "index": 1,
      "summary": "Validate timed plan fixtures",
      "start": "2026-06-17T14:00:00Z",
      "end": "2026-06-17T14:30:00Z",
      "depends_on": [0]
    }
  ],
  "created_at": "2026-06-17T12:45:00Z"
}
